{
  "tenant_id": "synthetic-lab",
  "project": "digital-shelter",
  "source": "synthetic-fixture",
  "observed_at": "2026-07-11T08:00:00Z",
  "ingested_at": "2026-07-11T08:00:05Z",
  "metric": "critical_journey_availability",
  "value": 0.42,
  "unit": "ratio",
  "evidence_ref": "sha256:synthetic-09",
  "schema_version": "0.1.0",
  "attributes": {
    "synthetic": true,
    "review_required": true
  }
}
